{"artifact_schema_version":"audit_bundle_artifact.v1","audit_bundle_payload_hash":"759f8652192596efedd954fc7dd960b73ea32a1859a3802121e71a79fbe9b014","audit_bundle_policy_hash":"bddcfca711d9e6e924d7ddaa4ff4b69230589aeb0b256fc740fc096b189e63dd","audit_bundle_policy_version":"audit_bundle.v1","bundle_hash":"4d6b95cb9bb8ecf310460c25e2c122b30c5123514738657ab8067a3c72acf83a","code_version":"93e488b02086","config_hash":"12147af478fb3bd78e13706b67ea0e7e49ff33ccb17c3de0a9d3d6f086e1ca68","generated_at_utc":"2026-02-16T06:22:13+00:00","inputs":[{"artifact_path":"artifacts\\forecasts\\916a36568aa957fa9695fa7efbc244c9.json","code_version":"93e488b02086","config_hash":"faf1eef267344ffa21a4506bf09a4392bbf8cb9881de609dcc415d3888569ea0","generated_at_utc":null,"payload_hash":"4f53cda18c2baa0c0354bb5f9a3ecbe5ed12ab4d8e11ba873c2f11161202b945","policy_hash":null,"run_id":"916a36568aa957fa9695fa7efbc244c9","stage":"forecast"},{"artifact_path":"artifacts\\decisions\\3e91568526875452b154bcbbff3e232d.json","code_version":"93e488b02086","config_hash":"fbb98e19bd350d2ed2a0a436c81fb2478da55f271895a2af13d84cc5fd4d56cc","generated_at_utc":"2026-02-16T06:22:13+00:00","payload_hash":"2b86d00e3cc2941454d6065b4e265272a174f9037f1334b15c7fed82763cdfa9","policy_hash":"2074697f10612fbec37d249bd72edd06c0c622b98c264c2bf117fc79e9c26d55","run_id":"3e91568526875452b154bcbbff3e232d","stage":"decision"},{"artifact_path":"artifacts\\trade_plans\\4dd16d5b7dec55d180b7c05b53c949f8.json","code_version":"93e488b02086","config_hash":"4d4d929088bdb821dcce15773bb8b12b19dd746fa3d6e8131ebdf84bfc5c6193","generated_at_utc":"2026-02-16T06:22:13+00:00","payload_hash":"421b19ba7baf72161456164a0d5985767339ccc2e1f534819f7e4d44f3e23c25","policy_hash":"d58c1a0453df9f6a0e4ca970646c714f1a4c84a792d0ffd82ee1d3ef03f79fbd","run_id":"4dd16d5b7dec55d180b7c05b53c949f8","stage":"trade_plan"},{"artifact_path":"artifacts\\executions\\564486a746ab5960ba0287c8c8c319f4.json","code_version":"93e488b02086","config_hash":"91edb0ba14136f2b4b64744be7897b2ea6870aaad4c2efc5ee0cfaaa78b8cdc1","generated_at_utc":"2026-02-16T06:22:13+00:00","payload_hash":"39a10bf23933756a6fd48bfe9cd74a7d45a2cdc63f66fc91fbbde5410f7a6f2a","policy_hash":"e71a4c6011253fd6715d40fe332811583f9a530f63abf309f1ede24956c1865a","run_id":"564486a746ab5960ba0287c8c8c319f4","stage":"execution"},{"artifact_path":"artifacts\\portfolios\\500b1f18999652f7a341450d49242e59.json","code_version":"93e488b02086","config_hash":"cc61eaaae71963dfe2d78c3ac6fd64ddc8190f3a3ddddc2ce60ae3432457f36c","generated_at_utc":"2026-02-16T06:22:13+00:00","payload_hash":"f617a0d5d4312ebef6e83b61f339a30b524795f3bc5397ba5b2a8b477d812b8f","policy_hash":"b6199eaaa45dd159696d821fa9b8c9464f42cd0cd1a108475d0877728794097e","run_id":"500b1f18999652f7a341450d49242e59","stage":"portfolio"},{"artifact_path":"artifacts\\pipeline_runs\\583bf7242ca75c73bc906a89a5b9e2c2.json","code_version":"93e488b02086","config_hash":"5212fc207f8a49791cdacb4ba8cad6948204c282ffe325d5a1e95c49a1f258bd","generated_at_utc":"2026-02-16T06:22:13+00:00","payload_hash":"ee103b8f3c1977b6a42fbe4cd5c8eef1f8206525bca2df422d15598ed014e245","policy_hash":"a3838416baf618b27a402d7cb47ee9657cb6139d8554517475eaae669b2646d5","run_id":"583bf7242ca75c73bc906a89a5b9e2c2","stage":"pipeline"},{"artifact_path":"artifacts\\performance\\f3f67f96ca07595d93904e74c30fa58f.json","code_version":"93e488b02086","config_hash":"e47424f341b5a41cb1d59d3e9ebfe967c63b2b2bf1ea073bddcbc2eb8adccee2","generated_at_utc":"2026-02-16T06:22:13+00:00","payload_hash":"c5077cf6f42ff118e01e2a39e9219d8c3b5187493d213dd1209995996ba5a3e1","policy_hash":"47cbc2e706edaee1a4e21a96139ac3627bea323013f5385fdde2aedeaa5aaf0a","run_id":"f3f67f96ca07595d93904e74c30fa58f","stage":"performance"},{"artifact_path":"artifacts\\risks\\414e29de2d895326a6f6ea423f9b7898.json","code_version":"93e488b02086","config_hash":"139abdfe524de0e9991aabc05a44b3888bf44db1dbbe54ac1425641dade9b6f8","generated_at_utc":"2026-02-16T06:22:13+00:00","payload_hash":"c7f439f8d36f3853bd06232996d3b4301874d9c49fa823d321530f4bf8062808","policy_hash":"4a6695b60edd2fc481569ad7e63ee3182f187b1f05e0635afe1caaf5aef38874","run_id":"414e29de2d895326a6f6ea423f9b7898","stage":"risk"}],"params":{"artifacts_root":"artifacts"},"quality_flags":["coverage_below_target_50","coverage_below_target_90","insufficient_calibration_data","insufficient_inputs","insufficient_uncertainty_data","zero_notional"],"quality_warnings":[{"code":"coverage_below_target_50","message":"Observed 50% interval coverage below target.","source":"forecast_artifact.v1"},{"code":"coverage_below_target_50","message":"Observed 50% interval coverage below target.","source":"pipeline_run_artifact.v1"},{"code":"coverage_below_target_90","message":"Observed 90% interval coverage below target.","source":"forecast_artifact.v1"},{"code":"coverage_below_target_90","message":"Observed 90% interval coverage below target.","source":"pipeline_run_artifact.v1"},{"code":"insufficient_calibration_data","message":"Calibration quality gate: insufficient eval sample size.","source":"forecast_artifact.v1"},{"code":"insufficient_calibration_data","message":"Calibration quality gate: insufficient eval sample size.","source":"pipeline_run_artifact.v1"},{"code":"insufficient_inputs","message":"Performance report built with fewer than two portfolio artifacts; aggregate stability is limited.","source":"performance_report_artifact.v1"},{"code":"insufficient_uncertainty_data","message":"Uncertainty report has insufficient sample size.","source":"forecast_artifact.v1"},{"code":"insufficient_uncertainty_data","message":"Uncertainty report has insufficient sample size.","source":"pipeline_run_artifact.v1"},{"code":"zero_notional","message":"Portfolio run 500b1f18999652f7a341450d49242e59 has zero notional exposure.","source":"performance_report_artifact.v1"}],"run_id":"bacf8771290f5a79a0bb97d5499eec70","timeline":[{"artifact_path":"artifacts\\forecasts\\916a36568aa957fa9695fa7efbc244c9.json","code_version":"93e488b02086","config_hash":"faf1eef267344ffa21a4506bf09a4392bbf8cb9881de609dcc415d3888569ea0","generated_at_utc":null,"payload_hash":"4f53cda18c2baa0c0354bb5f9a3ecbe5ed12ab4d8e11ba873c2f11161202b945","policy_hash":null,"run_id":"916a36568aa957fa9695fa7efbc244c9","stage":"forecast"},{"artifact_path":"artifacts\\decisions\\3e91568526875452b154bcbbff3e232d.json","code_version":"93e488b02086","config_hash":"fbb98e19bd350d2ed2a0a436c81fb2478da55f271895a2af13d84cc5fd4d56cc","generated_at_utc":"2026-02-16T06:22:13+00:00","payload_hash":"2b86d00e3cc2941454d6065b4e265272a174f9037f1334b15c7fed82763cdfa9","policy_hash":"2074697f10612fbec37d249bd72edd06c0c622b98c264c2bf117fc79e9c26d55","run_id":"3e91568526875452b154bcbbff3e232d","stage":"decision"},{"artifact_path":"artifacts\\trade_plans\\4dd16d5b7dec55d180b7c05b53c949f8.json","code_version":"93e488b02086","config_hash":"4d4d929088bdb821dcce15773bb8b12b19dd746fa3d6e8131ebdf84bfc5c6193","generated_at_utc":"2026-02-16T06:22:13+00:00","payload_hash":"421b19ba7baf72161456164a0d5985767339ccc2e1f534819f7e4d44f3e23c25","policy_hash":"d58c1a0453df9f6a0e4ca970646c714f1a4c84a792d0ffd82ee1d3ef03f79fbd","run_id":"4dd16d5b7dec55d180b7c05b53c949f8","stage":"trade_plan"},{"artifact_path":"artifacts\\executions\\564486a746ab5960ba0287c8c8c319f4.json","code_version":"93e488b02086","config_hash":"91edb0ba14136f2b4b64744be7897b2ea6870aaad4c2efc5ee0cfaaa78b8cdc1","generated_at_utc":"2026-02-16T06:22:13+00:00","payload_hash":"39a10bf23933756a6fd48bfe9cd74a7d45a2cdc63f66fc91fbbde5410f7a6f2a","policy_hash":"e71a4c6011253fd6715d40fe332811583f9a530f63abf309f1ede24956c1865a","run_id":"564486a746ab5960ba0287c8c8c319f4","stage":"execution"},{"artifact_path":"artifacts\\portfolios\\500b1f18999652f7a341450d49242e59.json","code_version":"93e488b02086","config_hash":"cc61eaaae71963dfe2d78c3ac6fd64ddc8190f3a3ddddc2ce60ae3432457f36c","generated_at_utc":"2026-02-16T06:22:13+00:00","payload_hash":"f617a0d5d4312ebef6e83b61f339a30b524795f3bc5397ba5b2a8b477d812b8f","policy_hash":"b6199eaaa45dd159696d821fa9b8c9464f42cd0cd1a108475d0877728794097e","run_id":"500b1f18999652f7a341450d49242e59","stage":"portfolio"},{"artifact_path":"artifacts\\pipeline_runs\\583bf7242ca75c73bc906a89a5b9e2c2.json","code_version":"93e488b02086","config_hash":"5212fc207f8a49791cdacb4ba8cad6948204c282ffe325d5a1e95c49a1f258bd","generated_at_utc":"2026-02-16T06:22:13+00:00","payload_hash":"ee103b8f3c1977b6a42fbe4cd5c8eef1f8206525bca2df422d15598ed014e245","policy_hash":"a3838416baf618b27a402d7cb47ee9657cb6139d8554517475eaae669b2646d5","run_id":"583bf7242ca75c73bc906a89a5b9e2c2","stage":"pipeline"},{"artifact_path":"artifacts\\performance\\f3f67f96ca07595d93904e74c30fa58f.json","code_version":"93e488b02086","config_hash":"e47424f341b5a41cb1d59d3e9ebfe967c63b2b2bf1ea073bddcbc2eb8adccee2","generated_at_utc":"2026-02-16T06:22:13+00:00","payload_hash":"c5077cf6f42ff118e01e2a39e9219d8c3b5187493d213dd1209995996ba5a3e1","policy_hash":"47cbc2e706edaee1a4e21a96139ac3627bea323013f5385fdde2aedeaa5aaf0a","run_id":"f3f67f96ca07595d93904e74c30fa58f","stage":"performance"},{"artifact_path":"artifacts\\risks\\414e29de2d895326a6f6ea423f9b7898.json","code_version":"93e488b02086","config_hash":"139abdfe524de0e9991aabc05a44b3888bf44db1dbbe54ac1425641dade9b6f8","generated_at_utc":"2026-02-16T06:22:13+00:00","payload_hash":"c7f439f8d36f3853bd06232996d3b4301874d9c49fa823d321530f4bf8062808","policy_hash":"4a6695b60edd2fc481569ad7e63ee3182f187b1f05e0635afe1caaf5aef38874","run_id":"414e29de2d895326a6f6ea423f9b7898","stage":"risk"}]}