{"artifact_schema_version":"audit_bundle_artifact.v1","audit_bundle_payload_hash":"57309b2b659b7aaba0c02a79dc3877c3ed16764a97d55d553afc29baf408ffa7","audit_bundle_policy_hash":"bddcfca711d9e6e924d7ddaa4ff4b69230589aeb0b256fc740fc096b189e63dd","audit_bundle_policy_version":"audit_bundle.v1","bundle_hash":"f68168449c6da007ef08b29cc0c8b2b539705620eacc928ed73b71608af9ee16","code_version":"93e488b02086","config_hash":"3c598dd6f947c5d4445e0880f398b014a3fe863a0f07cf2cd5b391931dfe90cd","generated_at_utc":"2026-02-16T06:22:13+00:00","inputs":[{"artifact_path":"artifacts\\forecasts\\916a36568aa957fa9695fa7efbc244c9.json","code_version":"93e488b02086","config_hash":"faf1eef267344ffa21a4506bf09a4392bbf8cb9881de609dcc415d3888569ea0","generated_at_utc":null,"payload_hash":"4f53cda18c2baa0c0354bb5f9a3ecbe5ed12ab4d8e11ba873c2f11161202b945","policy_hash":null,"run_id":"916a36568aa957fa9695fa7efbc244c9","stage":"forecast"},{"artifact_path":"artifacts\\decisions\\a007d1a8cdfb5786a347c07025f77b3d.json","code_version":"93e488b02086","config_hash":"fbb98e19bd350d2ed2a0a436c81fb2478da55f271895a2af13d84cc5fd4d56cc","generated_at_utc":"2026-02-16T06:22:13+00:00","payload_hash":"fd91cc39434a0e38c20e8d5640bb1a233df2bd9f67d96a653c480265a01c6ec9","policy_hash":"2074697f10612fbec37d249bd72edd06c0c622b98c264c2bf117fc79e9c26d55","run_id":"a007d1a8cdfb5786a347c07025f77b3d","stage":"decision"},{"artifact_path":"artifacts\\trade_plans\\99c96ea5a48956808365543981fdd3bd.json","code_version":"93e488b02086","config_hash":"1b4330b3d1af332cb53ac5377dd510c5d361001e7fc429785df095f68330aae2","generated_at_utc":"2026-02-16T06:22:13+00:00","payload_hash":"c0b69bd09729bf2136a02d9c7ded8679228ca9a100252e9bea175bbaa28753c2","policy_hash":"d58c1a0453df9f6a0e4ca970646c714f1a4c84a792d0ffd82ee1d3ef03f79fbd","run_id":"99c96ea5a48956808365543981fdd3bd","stage":"trade_plan"},{"artifact_path":"artifacts\\executions\\e8ec14b3f652540b90d89787f83d8ced.json","code_version":"93e488b02086","config_hash":"0005e9e62a3b5c242607e1f713647c016aa3b7179468b83411f494251450ad84","generated_at_utc":"2026-02-16T06:22:13+00:00","payload_hash":"852e00b96c61c71933842a175de46184fbef595e447aa9c7ced77a8cd3871e99","policy_hash":"e71a4c6011253fd6715d40fe332811583f9a530f63abf309f1ede24956c1865a","run_id":"e8ec14b3f652540b90d89787f83d8ced","stage":"execution"},{"artifact_path":"artifacts\\portfolios\\d905a7bcd0b75ba690f585276b979bf3.json","code_version":"93e488b02086","config_hash":"cb7baaa58864042e3d735560e45d3b13a999c938de7c95131cda9594f53624f0","generated_at_utc":"2026-02-16T06:22:13+00:00","payload_hash":"35245b1fb5feb026dfdfc2e6e2946a5010f8b0d85f5e98bf49f2c2d7353f1126","policy_hash":"b6199eaaa45dd159696d821fa9b8c9464f42cd0cd1a108475d0877728794097e","run_id":"d905a7bcd0b75ba690f585276b979bf3","stage":"portfolio"},{"artifact_path":"artifacts\\pipeline_runs\\4952729ce45953aca42db3a74b5c4491.json","code_version":"93e488b02086","config_hash":"5212fc207f8a49791cdacb4ba8cad6948204c282ffe325d5a1e95c49a1f258bd","generated_at_utc":"2026-02-16T06:22:13+00:00","payload_hash":"0b74f32b9b2ba9a7b8c06ad472ee97d002bb7145693843196490c7bdc4ec69d9","policy_hash":"a3838416baf618b27a402d7cb47ee9657cb6139d8554517475eaae669b2646d5","run_id":"4952729ce45953aca42db3a74b5c4491","stage":"pipeline"},{"artifact_path":"artifacts\\performance\\97e4b2e448e55c20a89f65f3e70df6b0.json","code_version":"93e488b02086","config_hash":"34d3fe662093c15ce3c9688ded7da621518fd392a38fa78ab62b251c219f3032","generated_at_utc":"2026-02-16T06:22:13+00:00","payload_hash":"4ab18d4f94fc38a5b833cd215cb704f4611f0b0a6e16c0d52cad3ecdc0a93585","policy_hash":"47cbc2e706edaee1a4e21a96139ac3627bea323013f5385fdde2aedeaa5aaf0a","run_id":"97e4b2e448e55c20a89f65f3e70df6b0","stage":"performance"},{"artifact_path":"artifacts\\risks\\b36c65ba243c5d0986b5c147bb3efae6.json","code_version":"93e488b02086","config_hash":"a01a8f34c26737c9c04bf75180c126fb351521bc35299610404d26e82dba4cdf","generated_at_utc":"2026-02-16T06:22:13+00:00","payload_hash":"245e9e9828c0029d768c1aa5208ce7b8a0f4546bf8b40a7e639eee33b1083f24","policy_hash":"4a6695b60edd2fc481569ad7e63ee3182f187b1f05e0635afe1caaf5aef38874","run_id":"b36c65ba243c5d0986b5c147bb3efae6","stage":"risk"}],"params":{"artifacts_root":"artifacts"},"quality_flags":["coverage_below_target_50","coverage_below_target_90","insufficient_calibration_data","insufficient_inputs","insufficient_uncertainty_data","zero_notional"],"quality_warnings":[{"code":"coverage_below_target_50","message":"Observed 50% interval coverage below target.","source":"forecast_artifact.v1"},{"code":"coverage_below_target_50","message":"Observed 50% interval coverage below target.","source":"pipeline_run_artifact.v1"},{"code":"coverage_below_target_90","message":"Observed 90% interval coverage below target.","source":"forecast_artifact.v1"},{"code":"coverage_below_target_90","message":"Observed 90% interval coverage below target.","source":"pipeline_run_artifact.v1"},{"code":"insufficient_calibration_data","message":"Calibration quality gate: insufficient eval sample size.","source":"forecast_artifact.v1"},{"code":"insufficient_calibration_data","message":"Calibration quality gate: insufficient eval sample size.","source":"pipeline_run_artifact.v1"},{"code":"insufficient_inputs","message":"Performance report built with fewer than two portfolio artifacts; aggregate stability is limited.","source":"performance_report_artifact.v1"},{"code":"insufficient_uncertainty_data","message":"Uncertainty report has insufficient sample size.","source":"forecast_artifact.v1"},{"code":"insufficient_uncertainty_data","message":"Uncertainty report has insufficient sample size.","source":"pipeline_run_artifact.v1"},{"code":"zero_notional","message":"Portfolio run d905a7bcd0b75ba690f585276b979bf3 has zero notional exposure.","source":"performance_report_artifact.v1"}],"run_id":"378fecdfbb5951629e13892d4253e8bc","timeline":[{"artifact_path":"artifacts\\forecasts\\916a36568aa957fa9695fa7efbc244c9.json","code_version":"93e488b02086","config_hash":"faf1eef267344ffa21a4506bf09a4392bbf8cb9881de609dcc415d3888569ea0","generated_at_utc":null,"payload_hash":"4f53cda18c2baa0c0354bb5f9a3ecbe5ed12ab4d8e11ba873c2f11161202b945","policy_hash":null,"run_id":"916a36568aa957fa9695fa7efbc244c9","stage":"forecast"},{"artifact_path":"artifacts\\decisions\\a007d1a8cdfb5786a347c07025f77b3d.json","code_version":"93e488b02086","config_hash":"fbb98e19bd350d2ed2a0a436c81fb2478da55f271895a2af13d84cc5fd4d56cc","generated_at_utc":"2026-02-16T06:22:13+00:00","payload_hash":"fd91cc39434a0e38c20e8d5640bb1a233df2bd9f67d96a653c480265a01c6ec9","policy_hash":"2074697f10612fbec37d249bd72edd06c0c622b98c264c2bf117fc79e9c26d55","run_id":"a007d1a8cdfb5786a347c07025f77b3d","stage":"decision"},{"artifact_path":"artifacts\\trade_plans\\99c96ea5a48956808365543981fdd3bd.json","code_version":"93e488b02086","config_hash":"1b4330b3d1af332cb53ac5377dd510c5d361001e7fc429785df095f68330aae2","generated_at_utc":"2026-02-16T06:22:13+00:00","payload_hash":"c0b69bd09729bf2136a02d9c7ded8679228ca9a100252e9bea175bbaa28753c2","policy_hash":"d58c1a0453df9f6a0e4ca970646c714f1a4c84a792d0ffd82ee1d3ef03f79fbd","run_id":"99c96ea5a48956808365543981fdd3bd","stage":"trade_plan"},{"artifact_path":"artifacts\\executions\\e8ec14b3f652540b90d89787f83d8ced.json","code_version":"93e488b02086","config_hash":"0005e9e62a3b5c242607e1f713647c016aa3b7179468b83411f494251450ad84","generated_at_utc":"2026-02-16T06:22:13+00:00","payload_hash":"852e00b96c61c71933842a175de46184fbef595e447aa9c7ced77a8cd3871e99","policy_hash":"e71a4c6011253fd6715d40fe332811583f9a530f63abf309f1ede24956c1865a","run_id":"e8ec14b3f652540b90d89787f83d8ced","stage":"execution"},{"artifact_path":"artifacts\\portfolios\\d905a7bcd0b75ba690f585276b979bf3.json","code_version":"93e488b02086","config_hash":"cb7baaa58864042e3d735560e45d3b13a999c938de7c95131cda9594f53624f0","generated_at_utc":"2026-02-16T06:22:13+00:00","payload_hash":"35245b1fb5feb026dfdfc2e6e2946a5010f8b0d85f5e98bf49f2c2d7353f1126","policy_hash":"b6199eaaa45dd159696d821fa9b8c9464f42cd0cd1a108475d0877728794097e","run_id":"d905a7bcd0b75ba690f585276b979bf3","stage":"portfolio"},{"artifact_path":"artifacts\\pipeline_runs\\4952729ce45953aca42db3a74b5c4491.json","code_version":"93e488b02086","config_hash":"5212fc207f8a49791cdacb4ba8cad6948204c282ffe325d5a1e95c49a1f258bd","generated_at_utc":"2026-02-16T06:22:13+00:00","payload_hash":"0b74f32b9b2ba9a7b8c06ad472ee97d002bb7145693843196490c7bdc4ec69d9","policy_hash":"a3838416baf618b27a402d7cb47ee9657cb6139d8554517475eaae669b2646d5","run_id":"4952729ce45953aca42db3a74b5c4491","stage":"pipeline"},{"artifact_path":"artifacts\\performance\\97e4b2e448e55c20a89f65f3e70df6b0.json","code_version":"93e488b02086","config_hash":"34d3fe662093c15ce3c9688ded7da621518fd392a38fa78ab62b251c219f3032","generated_at_utc":"2026-02-16T06:22:13+00:00","payload_hash":"4ab18d4f94fc38a5b833cd215cb704f4611f0b0a6e16c0d52cad3ecdc0a93585","policy_hash":"47cbc2e706edaee1a4e21a96139ac3627bea323013f5385fdde2aedeaa5aaf0a","run_id":"97e4b2e448e55c20a89f65f3e70df6b0","stage":"performance"},{"artifact_path":"artifacts\\risks\\b36c65ba243c5d0986b5c147bb3efae6.json","code_version":"93e488b02086","config_hash":"a01a8f34c26737c9c04bf75180c126fb351521bc35299610404d26e82dba4cdf","generated_at_utc":"2026-02-16T06:22:13+00:00","payload_hash":"245e9e9828c0029d768c1aa5208ce7b8a0f4546bf8b40a7e639eee33b1083f24","policy_hash":"4a6695b60edd2fc481569ad7e63ee3182f187b1f05e0635afe1caaf5aef38874","run_id":"b36c65ba243c5d0986b5c147bb3efae6","stage":"risk"}]}