{"artifact_schema_version":"audit_bundle_artifact.v1","audit_bundle_payload_hash":"d444b885b681afec50eb11f1377f1d14451d54b9bc8972d3cac61446702700e2","audit_bundle_policy_hash":"bddcfca711d9e6e924d7ddaa4ff4b69230589aeb0b256fc740fc096b189e63dd","audit_bundle_policy_version":"audit_bundle.v1","bundle_hash":"d19a1a94a81c8b62e863521ffb219c0674064e12351210105aab54af6d7e00a1","code_version":"93e488b02086","config_hash":"a0a0ed82280fdfc309b6f156838afea211d7fa96c73e6a0daf3aad7c67c6d9a9","generated_at_utc":"2026-03-10T00:00:00+00:00","inputs":[{"artifact_path":"C:\\Users\\AuslFe\\Desktop\\PROBITY\\artifacts\\forecasts\\239d1cd6e6db5370a62663353ea4ded4.json","code_version":"93e488b02086","config_hash":"56208df89b9cd1e0cd8b65c575e06d3e139d4c829386108d189e423e9f701304","generated_at_utc":null,"payload_hash":"4f53cda18c2baa0c0354bb5f9a3ecbe5ed12ab4d8e11ba873c2f11161202b945","policy_hash":null,"run_id":"239d1cd6e6db5370a62663353ea4ded4","stage":"forecast"},{"artifact_path":"artifacts\\decisions\\255b7d38448c54f38811dec253bef195.json","code_version":"93e488b02086","config_hash":"422becf27b019b292c37ab1a95be40dabaa92e8a38747ec166dc3dc48f65d75b","generated_at_utc":"2026-03-10T00:00:00+00:00","payload_hash":"da4b96b3b10807cb8eba7076c4fafe4d459a784e0b9175b937a2c73b485c0dfc","policy_hash":"2074697f10612fbec37d249bd72edd06c0c622b98c264c2bf117fc79e9c26d55","run_id":"255b7d38448c54f38811dec253bef195","stage":"decision"},{"artifact_path":"artifacts\\trade_plans\\bd362872ede5592c9f0ed74664867077.json","code_version":"93e488b02086","config_hash":"ce6d4ec82e0b0ddc1e851efb0ad80297a8ab453af0157564e1c3804342a7504b","generated_at_utc":"2026-03-10T00:00:00+00:00","payload_hash":"34e0c3a8826c29047c92191be8fbb557f09387afeff135ed1ee14c533a988859","policy_hash":"d58c1a0453df9f6a0e4ca970646c714f1a4c84a792d0ffd82ee1d3ef03f79fbd","run_id":"bd362872ede5592c9f0ed74664867077","stage":"trade_plan"},{"artifact_path":"artifacts\\executions\\9cf834bc3f7c5103bde23c946be43b97.json","code_version":"93e488b02086","config_hash":"da8f43ff369d128e975e3a7cf42876853264a78a56fea65487b9165f925c997b","generated_at_utc":"2026-03-10T00:00:00+00:00","payload_hash":"7c48486511804d057e0aa10f3a1e9e0c2be4817d3fbbb709361c0fc3042dc629","policy_hash":"e71a4c6011253fd6715d40fe332811583f9a530f63abf309f1ede24956c1865a","run_id":"9cf834bc3f7c5103bde23c946be43b97","stage":"execution"},{"artifact_path":"artifacts\\portfolios\\6f42763de453501d9bb460ca9b008cd9.json","code_version":"93e488b02086","config_hash":"d78fe19ca2d8c88a96825fb35d35b34c588f35846eab0912c140d57186d0fa81","generated_at_utc":"2026-03-10T00:00:00+00:00","payload_hash":"57a8ecac6bd1647d77308dde272092731f977f9edb845826713f1bacdcbbe803","policy_hash":"b6199eaaa45dd159696d821fa9b8c9464f42cd0cd1a108475d0877728794097e","run_id":"6f42763de453501d9bb460ca9b008cd9","stage":"portfolio"},{"artifact_path":"artifacts\\pipeline_runs\\04043fe14acc58c3a864569edd216c61.json","code_version":"93e488b02086","config_hash":"24e442b6b82cf5ea3e5ca258bbf950b7ee40a39003be375b10cf7662d4032bc9","generated_at_utc":"2026-03-10T00:00:00+00:00","payload_hash":"6b16ebdaeadbb283b418edc0ed7597afba99a3fccc9d650ca6903fe39ce4d7ca","policy_hash":"a3838416baf618b27a402d7cb47ee9657cb6139d8554517475eaae669b2646d5","run_id":"04043fe14acc58c3a864569edd216c61","stage":"pipeline"},{"artifact_path":"artifacts\\performance\\4db5a92e9ea75e07887e75355689d1ef.json","code_version":"93e488b02086","config_hash":"300ce3b592dd9acf4749131503da7da3d5a205f0ea7bce4ce9382eff901f7322","generated_at_utc":"2026-03-10T00:00:00+00:00","payload_hash":"0f08eaffec66839f243a2cad10a0456242c437fc585c6fd36b29ad4fc148aeb0","policy_hash":"47cbc2e706edaee1a4e21a96139ac3627bea323013f5385fdde2aedeaa5aaf0a","run_id":"4db5a92e9ea75e07887e75355689d1ef","stage":"performance"},{"artifact_path":"artifacts\\risks\\78df8eb06abd5eaa922689785d16c5d4.json","code_version":"93e488b02086","config_hash":"24136522499e7c84d9cf7a3acc06ab3ba08f2ed368a3565ebe15a121ecd25f86","generated_at_utc":"2026-03-10T00:00:00+00:00","payload_hash":"7c9875d5a8b8ee3a4e1738d66a163d29470c57225563b6482fa28cb342fac32f","policy_hash":"4a6695b60edd2fc481569ad7e63ee3182f187b1f05e0635afe1caaf5aef38874","run_id":"78df8eb06abd5eaa922689785d16c5d4","stage":"risk"}],"params":{"artifacts_root":"artifacts"},"quality_flags":["coverage_below_target_50","coverage_below_target_90","insufficient_calibration_data","insufficient_inputs","insufficient_uncertainty_data","zero_notional"],"quality_warnings":[{"code":"coverage_below_target_50","message":"Observed 50% interval coverage below target.","source":"forecast_artifact.v1"},{"code":"coverage_below_target_50","message":"Observed 50% interval coverage below target.","source":"pipeline_run_artifact.v1"},{"code":"coverage_below_target_90","message":"Observed 90% interval coverage below target.","source":"forecast_artifact.v1"},{"code":"coverage_below_target_90","message":"Observed 90% interval coverage below target.","source":"pipeline_run_artifact.v1"},{"code":"insufficient_calibration_data","message":"Calibration quality gate: insufficient eval sample size.","source":"forecast_artifact.v1"},{"code":"insufficient_calibration_data","message":"Calibration quality gate: insufficient eval sample size.","source":"pipeline_run_artifact.v1"},{"code":"insufficient_inputs","message":"Performance report built with fewer than two portfolio artifacts; aggregate stability is limited.","source":"performance_report_artifact.v1"},{"code":"insufficient_uncertainty_data","message":"Uncertainty report has insufficient sample size.","source":"forecast_artifact.v1"},{"code":"insufficient_uncertainty_data","message":"Uncertainty report has insufficient sample size.","source":"pipeline_run_artifact.v1"},{"code":"zero_notional","message":"Portfolio run 6f42763de453501d9bb460ca9b008cd9 has zero notional exposure.","source":"performance_report_artifact.v1"}],"run_id":"b5fe6378028c56fcb7beddf84e87d258","timeline":[{"artifact_path":"C:\\Users\\AuslFe\\Desktop\\PROBITY\\artifacts\\forecasts\\239d1cd6e6db5370a62663353ea4ded4.json","code_version":"93e488b02086","config_hash":"56208df89b9cd1e0cd8b65c575e06d3e139d4c829386108d189e423e9f701304","generated_at_utc":null,"payload_hash":"4f53cda18c2baa0c0354bb5f9a3ecbe5ed12ab4d8e11ba873c2f11161202b945","policy_hash":null,"run_id":"239d1cd6e6db5370a62663353ea4ded4","stage":"forecast"},{"artifact_path":"artifacts\\decisions\\255b7d38448c54f38811dec253bef195.json","code_version":"93e488b02086","config_hash":"422becf27b019b292c37ab1a95be40dabaa92e8a38747ec166dc3dc48f65d75b","generated_at_utc":"2026-03-10T00:00:00+00:00","payload_hash":"da4b96b3b10807cb8eba7076c4fafe4d459a784e0b9175b937a2c73b485c0dfc","policy_hash":"2074697f10612fbec37d249bd72edd06c0c622b98c264c2bf117fc79e9c26d55","run_id":"255b7d38448c54f38811dec253bef195","stage":"decision"},{"artifact_path":"artifacts\\trade_plans\\bd362872ede5592c9f0ed74664867077.json","code_version":"93e488b02086","config_hash":"ce6d4ec82e0b0ddc1e851efb0ad80297a8ab453af0157564e1c3804342a7504b","generated_at_utc":"2026-03-10T00:00:00+00:00","payload_hash":"34e0c3a8826c29047c92191be8fbb557f09387afeff135ed1ee14c533a988859","policy_hash":"d58c1a0453df9f6a0e4ca970646c714f1a4c84a792d0ffd82ee1d3ef03f79fbd","run_id":"bd362872ede5592c9f0ed74664867077","stage":"trade_plan"},{"artifact_path":"artifacts\\executions\\9cf834bc3f7c5103bde23c946be43b97.json","code_version":"93e488b02086","config_hash":"da8f43ff369d128e975e3a7cf42876853264a78a56fea65487b9165f925c997b","generated_at_utc":"2026-03-10T00:00:00+00:00","payload_hash":"7c48486511804d057e0aa10f3a1e9e0c2be4817d3fbbb709361c0fc3042dc629","policy_hash":"e71a4c6011253fd6715d40fe332811583f9a530f63abf309f1ede24956c1865a","run_id":"9cf834bc3f7c5103bde23c946be43b97","stage":"execution"},{"artifact_path":"artifacts\\portfolios\\6f42763de453501d9bb460ca9b008cd9.json","code_version":"93e488b02086","config_hash":"d78fe19ca2d8c88a96825fb35d35b34c588f35846eab0912c140d57186d0fa81","generated_at_utc":"2026-03-10T00:00:00+00:00","payload_hash":"57a8ecac6bd1647d77308dde272092731f977f9edb845826713f1bacdcbbe803","policy_hash":"b6199eaaa45dd159696d821fa9b8c9464f42cd0cd1a108475d0877728794097e","run_id":"6f42763de453501d9bb460ca9b008cd9","stage":"portfolio"},{"artifact_path":"artifacts\\pipeline_runs\\04043fe14acc58c3a864569edd216c61.json","code_version":"93e488b02086","config_hash":"24e442b6b82cf5ea3e5ca258bbf950b7ee40a39003be375b10cf7662d4032bc9","generated_at_utc":"2026-03-10T00:00:00+00:00","payload_hash":"6b16ebdaeadbb283b418edc0ed7597afba99a3fccc9d650ca6903fe39ce4d7ca","policy_hash":"a3838416baf618b27a402d7cb47ee9657cb6139d8554517475eaae669b2646d5","run_id":"04043fe14acc58c3a864569edd216c61","stage":"pipeline"},{"artifact_path":"artifacts\\performance\\4db5a92e9ea75e07887e75355689d1ef.json","code_version":"93e488b02086","config_hash":"300ce3b592dd9acf4749131503da7da3d5a205f0ea7bce4ce9382eff901f7322","generated_at_utc":"2026-03-10T00:00:00+00:00","payload_hash":"0f08eaffec66839f243a2cad10a0456242c437fc585c6fd36b29ad4fc148aeb0","policy_hash":"47cbc2e706edaee1a4e21a96139ac3627bea323013f5385fdde2aedeaa5aaf0a","run_id":"4db5a92e9ea75e07887e75355689d1ef","stage":"performance"},{"artifact_path":"artifacts\\risks\\78df8eb06abd5eaa922689785d16c5d4.json","code_version":"93e488b02086","config_hash":"24136522499e7c84d9cf7a3acc06ab3ba08f2ed368a3565ebe15a121ecd25f86","generated_at_utc":"2026-03-10T00:00:00+00:00","payload_hash":"7c9875d5a8b8ee3a4e1738d66a163d29470c57225563b6482fa28cb342fac32f","policy_hash":"4a6695b60edd2fc481569ad7e63ee3182f187b1f05e0635afe1caaf5aef38874","run_id":"78df8eb06abd5eaa922689785d16c5d4","stage":"risk"}]}