{"artifact_schema_version":"audit_bundle_artifact.v1","audit_bundle_payload_hash":"8d96ab4a886e76492745cbbda8562b68e1eaaba6659897cbb6907e8e1302e66d","audit_bundle_policy_hash":"bddcfca711d9e6e924d7ddaa4ff4b69230589aeb0b256fc740fc096b189e63dd","audit_bundle_policy_version":"audit_bundle.v1","bundle_hash":"2ecb39dbbd023ff27612611c9e10ed9df15a95a009685678c64778b64c24e8f2","code_version":"93e488b02086","config_hash":"8d09dd7dcb52d4328057974e79823e54f1e38e7b2ba6126adc28f7e722c86d4b","generated_at_utc":"2026-02-01T00:00:00+00:00","inputs":[{"artifact_path":"tests\\fixtures\\forecast\\forecast_artifact_sample.json","code_version":"testcode123456","config_hash":"aaaaaaaaaaaaaaaaaaaaaaaaaaaaaaaaaaaaaaaaaaaaaaaaaaaaaaaaaaaaaaaa","generated_at_utc":null,"payload_hash":"ffffffffffffffffffffffffffffffffffffffffffffffffffffffffffffffff","policy_hash":null,"run_id":"forecast-run-sample","stage":"forecast"},{"artifact_path":"artifacts\\decisions\\5caa8583201f5980873a15394692519a.json","code_version":"93e488b02086","config_hash":"4712d1a06faf630ab0c19af46a05c36ef5a0e1e8150efbcdf7c926ae08a914a0","generated_at_utc":"2026-02-01T00:00:00+00:00","payload_hash":"491ab75101fda028430cf92023c41f34786fc3b6bb74b4cd8e4efb854644c831","policy_hash":"2074697f10612fbec37d249bd72edd06c0c622b98c264c2bf117fc79e9c26d55","run_id":"5caa8583201f5980873a15394692519a","stage":"decision"},{"artifact_path":"artifacts\\trade_plans\\8e7da4a9d9f15eba81539f677975749e.json","code_version":"93e488b02086","config_hash":"ce8c8e0dd5295e332136e64441df90ca350bad4031d317b642d3b378239c2d65","generated_at_utc":"2026-02-01T00:00:00+00:00","payload_hash":"3d974a9e5a6abf98a495442e7432547691d9026c6f7906540f92b39d08d1956a","policy_hash":"d58c1a0453df9f6a0e4ca970646c714f1a4c84a792d0ffd82ee1d3ef03f79fbd","run_id":"8e7da4a9d9f15eba81539f677975749e","stage":"trade_plan"},{"artifact_path":"artifacts\\executions\\185e739121885a998fc39eb17bf6efee.json","code_version":"93e488b02086","config_hash":"e107131352c7f1e47803b0c598d6ec8f670c74c2426ce3a4ad7024f58a280f99","generated_at_utc":"2026-02-01T00:00:00+00:00","payload_hash":"105179ca594a1bc1d5232033e32733981cdd122174ef5c87e86a553f65fc9f28","policy_hash":"e71a4c6011253fd6715d40fe332811583f9a530f63abf309f1ede24956c1865a","run_id":"185e739121885a998fc39eb17bf6efee","stage":"execution"},{"artifact_path":"artifacts\\portfolios\\6ce68484b3505454998719857f47b4f2.json","code_version":"93e488b02086","config_hash":"20ba57d358b77ef41baaaedd911dde5626fcedb054208ad136a547f08e008799","generated_at_utc":"2026-02-01T00:00:00+00:00","payload_hash":"7c48d1a2633e376bd002b22c6e412f3e006735c773d217a5a5074665df38b719","policy_hash":"b6199eaaa45dd159696d821fa9b8c9464f42cd0cd1a108475d0877728794097e","run_id":"6ce68484b3505454998719857f47b4f2","stage":"portfolio"},{"artifact_path":"artifacts\\pipeline_runs\\aa79e5253c2d5c82844cf57c039f6a86.json","code_version":"93e488b02086","config_hash":"5d455c383bc62644856afe69193e85fa032eb04b230ed548e3887789dffa903a","generated_at_utc":"2026-02-01T00:00:00+00:00","payload_hash":"e58a6218df51e33f5a593fe159f7aff6922fc7ea9bcac21ee7f86c50510014b0","policy_hash":"a3838416baf618b27a402d7cb47ee9657cb6139d8554517475eaae669b2646d5","run_id":"aa79e5253c2d5c82844cf57c039f6a86","stage":"pipeline"},{"artifact_path":"artifacts\\performance\\c6662c9576ac5bf49c57eee28c34c40c.json","code_version":"93e488b02086","config_hash":"3f3bee3c2c41488c8f8880796e7b9e3481a4237fae71b5f0ba2764a7d3b5569f","generated_at_utc":"2026-02-01T00:00:00+00:00","payload_hash":"8947461dee218a996a919f0454f2d93392338e541633ba6f5cb4f63ed8ac8a3b","policy_hash":"47cbc2e706edaee1a4e21a96139ac3627bea323013f5385fdde2aedeaa5aaf0a","run_id":"c6662c9576ac5bf49c57eee28c34c40c","stage":"performance"},{"artifact_path":"artifacts\\risks\\ea90bb11e20f510e9463fec0e4ee9fcd.json","code_version":"93e488b02086","config_hash":"129f243258332c6cf61be2dd5758d6a0192dc652f6a4ba5dd1e09ea6f07a1711","generated_at_utc":"2026-02-01T00:00:00+00:00","payload_hash":"0fc377c5226cb30d68ef6a2478a18e8e83cf975f1493c229502296ac545fd22c","policy_hash":"4a6695b60edd2fc481569ad7e63ee3182f187b1f05e0635afe1caaf5aef38874","run_id":"ea90bb11e20f510e9463fec0e4ee9fcd","stage":"risk"}],"params":{"artifacts_root":"artifacts"},"quality_flags":["extreme_concentration_top3","illiquid","insufficient_inputs","performance_concentration_top3_breach"],"quality_warnings":[{"code":"extreme_concentration_top3","message":"Portfolio run 6ce68484b3505454998719857f47b4f2 top3 notional share 1.000000 exceeds threshold 0.800000.","source":"performance_report_artifact.v1"},{"code":"illiquid","message":"Top depth below threshold.","source":"pipeline_run_artifact.v1"},{"code":"insufficient_inputs","message":"Performance report built with fewer than two portfolio artifacts; aggregate stability is limited.","source":"performance_report_artifact.v1"},{"code":"performance_concentration_top3_breach","message":"Historical top3 share 1.000000 exceeds cap 0.800000.","source":"risk_artifact.v1"}],"run_id":"712cac9c01765b0e84f987eab32918d8","timeline":[{"artifact_path":"tests\\fixtures\\forecast\\forecast_artifact_sample.json","code_version":"testcode123456","config_hash":"aaaaaaaaaaaaaaaaaaaaaaaaaaaaaaaaaaaaaaaaaaaaaaaaaaaaaaaaaaaaaaaa","generated_at_utc":null,"payload_hash":"ffffffffffffffffffffffffffffffffffffffffffffffffffffffffffffffff","policy_hash":null,"run_id":"forecast-run-sample","stage":"forecast"},{"artifact_path":"artifacts\\decisions\\5caa8583201f5980873a15394692519a.json","code_version":"93e488b02086","config_hash":"4712d1a06faf630ab0c19af46a05c36ef5a0e1e8150efbcdf7c926ae08a914a0","generated_at_utc":"2026-02-01T00:00:00+00:00","payload_hash":"491ab75101fda028430cf92023c41f34786fc3b6bb74b4cd8e4efb854644c831","policy_hash":"2074697f10612fbec37d249bd72edd06c0c622b98c264c2bf117fc79e9c26d55","run_id":"5caa8583201f5980873a15394692519a","stage":"decision"},{"artifact_path":"artifacts\\trade_plans\\8e7da4a9d9f15eba81539f677975749e.json","code_version":"93e488b02086","config_hash":"ce8c8e0dd5295e332136e64441df90ca350bad4031d317b642d3b378239c2d65","generated_at_utc":"2026-02-01T00:00:00+00:00","payload_hash":"3d974a9e5a6abf98a495442e7432547691d9026c6f7906540f92b39d08d1956a","policy_hash":"d58c1a0453df9f6a0e4ca970646c714f1a4c84a792d0ffd82ee1d3ef03f79fbd","run_id":"8e7da4a9d9f15eba81539f677975749e","stage":"trade_plan"},{"artifact_path":"artifacts\\executions\\185e739121885a998fc39eb17bf6efee.json","code_version":"93e488b02086","config_hash":"e107131352c7f1e47803b0c598d6ec8f670c74c2426ce3a4ad7024f58a280f99","generated_at_utc":"2026-02-01T00:00:00+00:00","payload_hash":"105179ca594a1bc1d5232033e32733981cdd122174ef5c87e86a553f65fc9f28","policy_hash":"e71a4c6011253fd6715d40fe332811583f9a530f63abf309f1ede24956c1865a","run_id":"185e739121885a998fc39eb17bf6efee","stage":"execution"},{"artifact_path":"artifacts\\portfolios\\6ce68484b3505454998719857f47b4f2.json","code_version":"93e488b02086","config_hash":"20ba57d358b77ef41baaaedd911dde5626fcedb054208ad136a547f08e008799","generated_at_utc":"2026-02-01T00:00:00+00:00","payload_hash":"7c48d1a2633e376bd002b22c6e412f3e006735c773d217a5a5074665df38b719","policy_hash":"b6199eaaa45dd159696d821fa9b8c9464f42cd0cd1a108475d0877728794097e","run_id":"6ce68484b3505454998719857f47b4f2","stage":"portfolio"},{"artifact_path":"artifacts\\pipeline_runs\\aa79e5253c2d5c82844cf57c039f6a86.json","code_version":"93e488b02086","config_hash":"5d455c383bc62644856afe69193e85fa032eb04b230ed548e3887789dffa903a","generated_at_utc":"2026-02-01T00:00:00+00:00","payload_hash":"e58a6218df51e33f5a593fe159f7aff6922fc7ea9bcac21ee7f86c50510014b0","policy_hash":"a3838416baf618b27a402d7cb47ee9657cb6139d8554517475eaae669b2646d5","run_id":"aa79e5253c2d5c82844cf57c039f6a86","stage":"pipeline"},{"artifact_path":"artifacts\\performance\\c6662c9576ac5bf49c57eee28c34c40c.json","code_version":"93e488b02086","config_hash":"3f3bee3c2c41488c8f8880796e7b9e3481a4237fae71b5f0ba2764a7d3b5569f","generated_at_utc":"2026-02-01T00:00:00+00:00","payload_hash":"8947461dee218a996a919f0454f2d93392338e541633ba6f5cb4f63ed8ac8a3b","policy_hash":"47cbc2e706edaee1a4e21a96139ac3627bea323013f5385fdde2aedeaa5aaf0a","run_id":"c6662c9576ac5bf49c57eee28c34c40c","stage":"performance"},{"artifact_path":"artifacts\\risks\\ea90bb11e20f510e9463fec0e4ee9fcd.json","code_version":"93e488b02086","config_hash":"129f243258332c6cf61be2dd5758d6a0192dc652f6a4ba5dd1e09ea6f07a1711","generated_at_utc":"2026-02-01T00:00:00+00:00","payload_hash":"0fc377c5226cb30d68ef6a2478a18e8e83cf975f1493c229502296ac545fd22c","policy_hash":"4a6695b60edd2fc481569ad7e63ee3182f187b1f05e0635afe1caaf5aef38874","run_id":"ea90bb11e20f510e9463fec0e4ee9fcd","stage":"risk"}]}