{"artifact_schema_version":"audit_bundle_artifact.v1","audit_bundle_payload_hash":"e16656b6a29eccfb7947191398130f290aa7a6e35edc6e44a0e0aeb93fb80879","audit_bundle_policy_hash":"bddcfca711d9e6e924d7ddaa4ff4b69230589aeb0b256fc740fc096b189e63dd","audit_bundle_policy_version":"audit_bundle.v1","bundle_hash":"18111befd827de1dcf61ace7a766942a5a4cb3ce00e72069f5961cf377b974b6","code_version":"93e488b02086","config_hash":"e8ec2f22c00f16eee93446fe2f8b86b0ec9b29c9fc719be7ad3c915b9bacffef","generated_at_utc":"2026-02-01T00:00:00+00:00","inputs":[{"artifact_path":"tests\\fixtures\\forecast\\forecast_artifact_sample.json","code_version":"testcode123456","config_hash":"aaaaaaaaaaaaaaaaaaaaaaaaaaaaaaaaaaaaaaaaaaaaaaaaaaaaaaaaaaaaaaaa","generated_at_utc":null,"payload_hash":"ffffffffffffffffffffffffffffffffffffffffffffffffffffffffffffffff","policy_hash":null,"run_id":"forecast-run-sample","stage":"forecast"},{"artifact_path":"artifacts\\decisions\\4b1f67b397d75781922dd5eabb1b5e7b.json","code_version":"93e488b02086","config_hash":"4712d1a06faf630ab0c19af46a05c36ef5a0e1e8150efbcdf7c926ae08a914a0","generated_at_utc":"2026-02-01T00:00:00+00:00","payload_hash":"752504cf68248288f764b3920c09b7bb1665886ba0938c3cb592962b0e69acc4","policy_hash":"2074697f10612fbec37d249bd72edd06c0c622b98c264c2bf117fc79e9c26d55","run_id":"4b1f67b397d75781922dd5eabb1b5e7b","stage":"decision"},{"artifact_path":"artifacts\\trade_plans\\99587b8cecbf59818561c19beb403a90.json","code_version":"93e488b02086","config_hash":"884e4ec2df12ad148d3e778aded1a5f2c7ee7a1bea4788824d99444cbd03c014","generated_at_utc":"2026-02-01T00:00:00+00:00","payload_hash":"de4b0ed51cfb9abe0fd8c92cde2cb9d4824c9aacd916af669c83f1bf84c51af9","policy_hash":"d58c1a0453df9f6a0e4ca970646c714f1a4c84a792d0ffd82ee1d3ef03f79fbd","run_id":"99587b8cecbf59818561c19beb403a90","stage":"trade_plan"},{"artifact_path":"artifacts\\executions\\063bfc4ee55e52a5a050a6fa749d009e.json","code_version":"93e488b02086","config_hash":"57ecece2ba66cd3009903727e507579a46f20391564c6f961f6e87c233b83ffc","generated_at_utc":"2026-02-01T00:00:00+00:00","payload_hash":"95c1657d7aa7981aa17499da9e71420d5886f9e89f042b5553db451e142e0b71","policy_hash":"e71a4c6011253fd6715d40fe332811583f9a530f63abf309f1ede24956c1865a","run_id":"063bfc4ee55e52a5a050a6fa749d009e","stage":"execution"},{"artifact_path":"artifacts\\portfolios\\bedfba2589365787b95cda410553e381.json","code_version":"93e488b02086","config_hash":"ce979b1a56119212d77679ef6df218d5aa232ff3b94c1b79414ddb8f7f0edb82","generated_at_utc":"2026-02-01T00:00:00+00:00","payload_hash":"d6e662f1fe07951a772e0a8d1ab17771d2de08bd19f650724a6784c96497d790","policy_hash":"b6199eaaa45dd159696d821fa9b8c9464f42cd0cd1a108475d0877728794097e","run_id":"bedfba2589365787b95cda410553e381","stage":"portfolio"},{"artifact_path":"artifacts\\pipeline_runs\\c7571290ab9a5c198b8e1a5b3632d604.json","code_version":"93e488b02086","config_hash":"5d455c383bc62644856afe69193e85fa032eb04b230ed548e3887789dffa903a","generated_at_utc":"2026-02-01T00:00:00+00:00","payload_hash":"839b67d65e855032f4987d8023d311db2ca5bc534ba6946436c8efb7b1058463","policy_hash":"a3838416baf618b27a402d7cb47ee9657cb6139d8554517475eaae669b2646d5","run_id":"c7571290ab9a5c198b8e1a5b3632d604","stage":"pipeline"},{"artifact_path":"artifacts\\performance\\fc03420691875675acd46f490d0b1649.json","code_version":"93e488b02086","config_hash":"abc09cacad7bf96773ae0760b261b1287a97943adc5bf45738f97df00ba82ba5","generated_at_utc":"2026-02-01T00:00:00+00:00","payload_hash":"f00b3d21e06fe44ce5e5cc6bc16192bbe5cf69b1ab577335ab5ea694bf5856b1","policy_hash":"47cbc2e706edaee1a4e21a96139ac3627bea323013f5385fdde2aedeaa5aaf0a","run_id":"fc03420691875675acd46f490d0b1649","stage":"performance"},{"artifact_path":"artifacts\\risks\\a1da31b031e251d39e60eff59ee3bef0.json","code_version":"93e488b02086","config_hash":"c595c31f7a35e0838ee795f8908a269754d6571b24062ee36e14a4833786b1c3","generated_at_utc":"2026-02-01T00:00:00+00:00","payload_hash":"7680747a97b554bfd3a32f234e57bd82f2aec2ba1cf9cc522cba0e3580e0127b","policy_hash":"4a6695b60edd2fc481569ad7e63ee3182f187b1f05e0635afe1caaf5aef38874","run_id":"a1da31b031e251d39e60eff59ee3bef0","stage":"risk"}],"params":{"artifacts_root":"artifacts"},"quality_flags":["extreme_concentration_top3","illiquid","insufficient_inputs","performance_concentration_top3_breach"],"quality_warnings":[{"code":"extreme_concentration_top3","message":"Portfolio run bedfba2589365787b95cda410553e381 top3 notional share 1.000000 exceeds threshold 0.800000.","source":"performance_report_artifact.v1"},{"code":"illiquid","message":"Top depth below threshold.","source":"pipeline_run_artifact.v1"},{"code":"insufficient_inputs","message":"Performance report built with fewer than two portfolio artifacts; aggregate stability is limited.","source":"performance_report_artifact.v1"},{"code":"performance_concentration_top3_breach","message":"Historical top3 share 1.000000 exceeds cap 0.800000.","source":"risk_artifact.v1"}],"run_id":"81ffe94c071054b8aa1b036fc75b928d","timeline":[{"artifact_path":"tests\\fixtures\\forecast\\forecast_artifact_sample.json","code_version":"testcode123456","config_hash":"aaaaaaaaaaaaaaaaaaaaaaaaaaaaaaaaaaaaaaaaaaaaaaaaaaaaaaaaaaaaaaaa","generated_at_utc":null,"payload_hash":"ffffffffffffffffffffffffffffffffffffffffffffffffffffffffffffffff","policy_hash":null,"run_id":"forecast-run-sample","stage":"forecast"},{"artifact_path":"artifacts\\decisions\\4b1f67b397d75781922dd5eabb1b5e7b.json","code_version":"93e488b02086","config_hash":"4712d1a06faf630ab0c19af46a05c36ef5a0e1e8150efbcdf7c926ae08a914a0","generated_at_utc":"2026-02-01T00:00:00+00:00","payload_hash":"752504cf68248288f764b3920c09b7bb1665886ba0938c3cb592962b0e69acc4","policy_hash":"2074697f10612fbec37d249bd72edd06c0c622b98c264c2bf117fc79e9c26d55","run_id":"4b1f67b397d75781922dd5eabb1b5e7b","stage":"decision"},{"artifact_path":"artifacts\\trade_plans\\99587b8cecbf59818561c19beb403a90.json","code_version":"93e488b02086","config_hash":"884e4ec2df12ad148d3e778aded1a5f2c7ee7a1bea4788824d99444cbd03c014","generated_at_utc":"2026-02-01T00:00:00+00:00","payload_hash":"de4b0ed51cfb9abe0fd8c92cde2cb9d4824c9aacd916af669c83f1bf84c51af9","policy_hash":"d58c1a0453df9f6a0e4ca970646c714f1a4c84a792d0ffd82ee1d3ef03f79fbd","run_id":"99587b8cecbf59818561c19beb403a90","stage":"trade_plan"},{"artifact_path":"artifacts\\executions\\063bfc4ee55e52a5a050a6fa749d009e.json","code_version":"93e488b02086","config_hash":"57ecece2ba66cd3009903727e507579a46f20391564c6f961f6e87c233b83ffc","generated_at_utc":"2026-02-01T00:00:00+00:00","payload_hash":"95c1657d7aa7981aa17499da9e71420d5886f9e89f042b5553db451e142e0b71","policy_hash":"e71a4c6011253fd6715d40fe332811583f9a530f63abf309f1ede24956c1865a","run_id":"063bfc4ee55e52a5a050a6fa749d009e","stage":"execution"},{"artifact_path":"artifacts\\portfolios\\bedfba2589365787b95cda410553e381.json","code_version":"93e488b02086","config_hash":"ce979b1a56119212d77679ef6df218d5aa232ff3b94c1b79414ddb8f7f0edb82","generated_at_utc":"2026-02-01T00:00:00+00:00","payload_hash":"d6e662f1fe07951a772e0a8d1ab17771d2de08bd19f650724a6784c96497d790","policy_hash":"b6199eaaa45dd159696d821fa9b8c9464f42cd0cd1a108475d0877728794097e","run_id":"bedfba2589365787b95cda410553e381","stage":"portfolio"},{"artifact_path":"artifacts\\pipeline_runs\\c7571290ab9a5c198b8e1a5b3632d604.json","code_version":"93e488b02086","config_hash":"5d455c383bc62644856afe69193e85fa032eb04b230ed548e3887789dffa903a","generated_at_utc":"2026-02-01T00:00:00+00:00","payload_hash":"839b67d65e855032f4987d8023d311db2ca5bc534ba6946436c8efb7b1058463","policy_hash":"a3838416baf618b27a402d7cb47ee9657cb6139d8554517475eaae669b2646d5","run_id":"c7571290ab9a5c198b8e1a5b3632d604","stage":"pipeline"},{"artifact_path":"artifacts\\performance\\fc03420691875675acd46f490d0b1649.json","code_version":"93e488b02086","config_hash":"abc09cacad7bf96773ae0760b261b1287a97943adc5bf45738f97df00ba82ba5","generated_at_utc":"2026-02-01T00:00:00+00:00","payload_hash":"f00b3d21e06fe44ce5e5cc6bc16192bbe5cf69b1ab577335ab5ea694bf5856b1","policy_hash":"47cbc2e706edaee1a4e21a96139ac3627bea323013f5385fdde2aedeaa5aaf0a","run_id":"fc03420691875675acd46f490d0b1649","stage":"performance"},{"artifact_path":"artifacts\\risks\\a1da31b031e251d39e60eff59ee3bef0.json","code_version":"93e488b02086","config_hash":"c595c31f7a35e0838ee795f8908a269754d6571b24062ee36e14a4833786b1c3","generated_at_utc":"2026-02-01T00:00:00+00:00","payload_hash":"7680747a97b554bfd3a32f234e57bd82f2aec2ba1cf9cc522cba0e3580e0127b","policy_hash":"4a6695b60edd2fc481569ad7e63ee3182f187b1f05e0635afe1caaf5aef38874","run_id":"a1da31b031e251d39e60eff59ee3bef0","stage":"risk"}]}