{"artifact_schema_version":"audit_bundle_artifact.v1","audit_bundle_payload_hash":"2bb8a7fce3d3c0780e1e1774a90b61726ab4a10a8509ca1638561092b748974e","audit_bundle_policy_hash":"bddcfca711d9e6e924d7ddaa4ff4b69230589aeb0b256fc740fc096b189e63dd","audit_bundle_policy_version":"audit_bundle.v1","bundle_hash":"bb1decfeb6a751bae3eb88ce95b3717d9ee62e6b6055687ba29e00a318eaee86","code_version":"93e488b02086","config_hash":"7e9502829a896a9861c159290d90751c499ee283a893071748c8b8dba0548793","generated_at_utc":"2026-02-16T06:22:13+00:00","inputs":[{"artifact_path":"C:\\Users\\AuslFe\\Desktop\\PROBITY\\artifacts\\forecasts\\916a36568aa957fa9695fa7efbc244c9.json","code_version":"93e488b02086","config_hash":"faf1eef267344ffa21a4506bf09a4392bbf8cb9881de609dcc415d3888569ea0","generated_at_utc":null,"payload_hash":"4f53cda18c2baa0c0354bb5f9a3ecbe5ed12ab4d8e11ba873c2f11161202b945","policy_hash":null,"run_id":"916a36568aa957fa9695fa7efbc244c9","stage":"forecast"},{"artifact_path":"artifacts\\decisions\\fbceffc87eb65dc3af7c9cd528b4e62b.json","code_version":"93e488b02086","config_hash":"fbb98e19bd350d2ed2a0a436c81fb2478da55f271895a2af13d84cc5fd4d56cc","generated_at_utc":"2026-02-16T06:22:13+00:00","payload_hash":"95efaaf00abf1b52b9c7641fb14abfdc3cc391b8f6a05946aa1313760bda0bc3","policy_hash":"2074697f10612fbec37d249bd72edd06c0c622b98c264c2bf117fc79e9c26d55","run_id":"fbceffc87eb65dc3af7c9cd528b4e62b","stage":"decision"},{"artifact_path":"artifacts\\trade_plans\\c99c7552207c5d2d8fd4cc79f77d828d.json","code_version":"93e488b02086","config_hash":"cc60c466554e695f1f9ef65e544ea64bfd758460a3c7f2f3a17a61109f2c78b8","generated_at_utc":"2026-02-16T06:22:13+00:00","payload_hash":"80358cdfbc88107c705eb9514070e60d234d355bbd563c25486925735ae18566","policy_hash":"d58c1a0453df9f6a0e4ca970646c714f1a4c84a792d0ffd82ee1d3ef03f79fbd","run_id":"c99c7552207c5d2d8fd4cc79f77d828d","stage":"trade_plan"},{"artifact_path":"artifacts\\executions\\fb817b2cc36059d8b0a40cd6184952e4.json","code_version":"93e488b02086","config_hash":"136b91ae1c2554b41a450020dfdad48f0dc572c10eee5e4f68c93e5988d546c0","generated_at_utc":"2026-02-16T06:22:13+00:00","payload_hash":"4857b2319b50a20ba373794c233671344ebaf4efc1e6abf41d3fa8db08c14da0","policy_hash":"e71a4c6011253fd6715d40fe332811583f9a530f63abf309f1ede24956c1865a","run_id":"fb817b2cc36059d8b0a40cd6184952e4","stage":"execution"},{"artifact_path":"artifacts\\portfolios\\549b6723f82657efa8528050551c2671.json","code_version":"93e488b02086","config_hash":"98e11e15e8bdfad549e7e1ebb6385fcfd550650d7351254c7bda61ec6d401199","generated_at_utc":"2026-02-16T06:22:13+00:00","payload_hash":"da4c05cb127113de6fef2c531212a1f8aaac911c366d539642d0ce67348203be","policy_hash":"b6199eaaa45dd159696d821fa9b8c9464f42cd0cd1a108475d0877728794097e","run_id":"549b6723f82657efa8528050551c2671","stage":"portfolio"},{"artifact_path":"artifacts\\pipeline_runs\\1d091c81eef1541ebacd9d6ba2180f6f.json","code_version":"93e488b02086","config_hash":"45c253764827b8e77ed8def40cb25aacfb70c8ead310774662aa6a183818a577","generated_at_utc":"2026-02-16T06:22:13+00:00","payload_hash":"7173b40fbe1bab5c56dbe3c2989beec1101994f69c60da6e638d35dcd5e90e33","policy_hash":"a3838416baf618b27a402d7cb47ee9657cb6139d8554517475eaae669b2646d5","run_id":"1d091c81eef1541ebacd9d6ba2180f6f","stage":"pipeline"},{"artifact_path":"artifacts\\performance\\678bc6ddecd15b0a811360750dce928e.json","code_version":"93e488b02086","config_hash":"412d80c2be55df955ff97874d19ab39a5efa3a6f4323763fc213aa5a6e487126","generated_at_utc":"2026-02-16T06:22:13+00:00","payload_hash":"b4a87652ad88bbd49f579768569376db5694a2c367c568e16a623dea1d57bb27","policy_hash":"47cbc2e706edaee1a4e21a96139ac3627bea323013f5385fdde2aedeaa5aaf0a","run_id":"678bc6ddecd15b0a811360750dce928e","stage":"performance"},{"artifact_path":"artifacts\\risks\\81b0370e335556f9b25859ae206d0050.json","code_version":"93e488b02086","config_hash":"d7e7077cf286df2e1f21a17397e54a62f6a20cbf7963d963d18ea7fedc963c9c","generated_at_utc":"2026-02-16T06:22:13+00:00","payload_hash":"bb92745ed4e44af50afc70a33dab5026faac3b1f27081b3f4aa7b47417f5e039","policy_hash":"4a6695b60edd2fc481569ad7e63ee3182f187b1f05e0635afe1caaf5aef38874","run_id":"81b0370e335556f9b25859ae206d0050","stage":"risk"}],"params":{"artifacts_root":"artifacts"},"quality_flags":["coverage_below_target_50","coverage_below_target_90","insufficient_calibration_data","insufficient_inputs","insufficient_uncertainty_data","zero_notional"],"quality_warnings":[{"code":"coverage_below_target_50","message":"Observed 50% interval coverage below target.","source":"forecast_artifact.v1"},{"code":"coverage_below_target_50","message":"Observed 50% interval coverage below target.","source":"pipeline_run_artifact.v1"},{"code":"coverage_below_target_90","message":"Observed 90% interval coverage below target.","source":"forecast_artifact.v1"},{"code":"coverage_below_target_90","message":"Observed 90% interval coverage below target.","source":"pipeline_run_artifact.v1"},{"code":"insufficient_calibration_data","message":"Calibration quality gate: insufficient eval sample size.","source":"forecast_artifact.v1"},{"code":"insufficient_calibration_data","message":"Calibration quality gate: insufficient eval sample size.","source":"pipeline_run_artifact.v1"},{"code":"insufficient_inputs","message":"Performance report built with fewer than two portfolio artifacts; aggregate stability is limited.","source":"performance_report_artifact.v1"},{"code":"insufficient_uncertainty_data","message":"Uncertainty report has insufficient sample size.","source":"forecast_artifact.v1"},{"code":"insufficient_uncertainty_data","message":"Uncertainty report has insufficient sample size.","source":"pipeline_run_artifact.v1"},{"code":"zero_notional","message":"Portfolio run 549b6723f82657efa8528050551c2671 has zero notional exposure.","source":"performance_report_artifact.v1"}],"run_id":"ca4272e44293511ba354f057172de794","timeline":[{"artifact_path":"C:\\Users\\AuslFe\\Desktop\\PROBITY\\artifacts\\forecasts\\916a36568aa957fa9695fa7efbc244c9.json","code_version":"93e488b02086","config_hash":"faf1eef267344ffa21a4506bf09a4392bbf8cb9881de609dcc415d3888569ea0","generated_at_utc":null,"payload_hash":"4f53cda18c2baa0c0354bb5f9a3ecbe5ed12ab4d8e11ba873c2f11161202b945","policy_hash":null,"run_id":"916a36568aa957fa9695fa7efbc244c9","stage":"forecast"},{"artifact_path":"artifacts\\decisions\\fbceffc87eb65dc3af7c9cd528b4e62b.json","code_version":"93e488b02086","config_hash":"fbb98e19bd350d2ed2a0a436c81fb2478da55f271895a2af13d84cc5fd4d56cc","generated_at_utc":"2026-02-16T06:22:13+00:00","payload_hash":"95efaaf00abf1b52b9c7641fb14abfdc3cc391b8f6a05946aa1313760bda0bc3","policy_hash":"2074697f10612fbec37d249bd72edd06c0c622b98c264c2bf117fc79e9c26d55","run_id":"fbceffc87eb65dc3af7c9cd528b4e62b","stage":"decision"},{"artifact_path":"artifacts\\trade_plans\\c99c7552207c5d2d8fd4cc79f77d828d.json","code_version":"93e488b02086","config_hash":"cc60c466554e695f1f9ef65e544ea64bfd758460a3c7f2f3a17a61109f2c78b8","generated_at_utc":"2026-02-16T06:22:13+00:00","payload_hash":"80358cdfbc88107c705eb9514070e60d234d355bbd563c25486925735ae18566","policy_hash":"d58c1a0453df9f6a0e4ca970646c714f1a4c84a792d0ffd82ee1d3ef03f79fbd","run_id":"c99c7552207c5d2d8fd4cc79f77d828d","stage":"trade_plan"},{"artifact_path":"artifacts\\executions\\fb817b2cc36059d8b0a40cd6184952e4.json","code_version":"93e488b02086","config_hash":"136b91ae1c2554b41a450020dfdad48f0dc572c10eee5e4f68c93e5988d546c0","generated_at_utc":"2026-02-16T06:22:13+00:00","payload_hash":"4857b2319b50a20ba373794c233671344ebaf4efc1e6abf41d3fa8db08c14da0","policy_hash":"e71a4c6011253fd6715d40fe332811583f9a530f63abf309f1ede24956c1865a","run_id":"fb817b2cc36059d8b0a40cd6184952e4","stage":"execution"},{"artifact_path":"artifacts\\portfolios\\549b6723f82657efa8528050551c2671.json","code_version":"93e488b02086","config_hash":"98e11e15e8bdfad549e7e1ebb6385fcfd550650d7351254c7bda61ec6d401199","generated_at_utc":"2026-02-16T06:22:13+00:00","payload_hash":"da4c05cb127113de6fef2c531212a1f8aaac911c366d539642d0ce67348203be","policy_hash":"b6199eaaa45dd159696d821fa9b8c9464f42cd0cd1a108475d0877728794097e","run_id":"549b6723f82657efa8528050551c2671","stage":"portfolio"},{"artifact_path":"artifacts\\pipeline_runs\\1d091c81eef1541ebacd9d6ba2180f6f.json","code_version":"93e488b02086","config_hash":"45c253764827b8e77ed8def40cb25aacfb70c8ead310774662aa6a183818a577","generated_at_utc":"2026-02-16T06:22:13+00:00","payload_hash":"7173b40fbe1bab5c56dbe3c2989beec1101994f69c60da6e638d35dcd5e90e33","policy_hash":"a3838416baf618b27a402d7cb47ee9657cb6139d8554517475eaae669b2646d5","run_id":"1d091c81eef1541ebacd9d6ba2180f6f","stage":"pipeline"},{"artifact_path":"artifacts\\performance\\678bc6ddecd15b0a811360750dce928e.json","code_version":"93e488b02086","config_hash":"412d80c2be55df955ff97874d19ab39a5efa3a6f4323763fc213aa5a6e487126","generated_at_utc":"2026-02-16T06:22:13+00:00","payload_hash":"b4a87652ad88bbd49f579768569376db5694a2c367c568e16a623dea1d57bb27","policy_hash":"47cbc2e706edaee1a4e21a96139ac3627bea323013f5385fdde2aedeaa5aaf0a","run_id":"678bc6ddecd15b0a811360750dce928e","stage":"performance"},{"artifact_path":"artifacts\\risks\\81b0370e335556f9b25859ae206d0050.json","code_version":"93e488b02086","config_hash":"d7e7077cf286df2e1f21a17397e54a62f6a20cbf7963d963d18ea7fedc963c9c","generated_at_utc":"2026-02-16T06:22:13+00:00","payload_hash":"bb92745ed4e44af50afc70a33dab5026faac3b1f27081b3f4aa7b47417f5e039","policy_hash":"4a6695b60edd2fc481569ad7e63ee3182f187b1f05e0635afe1caaf5aef38874","run_id":"81b0370e335556f9b25859ae206d0050","stage":"risk"}]}